{
  "schemaVersion": 1,
  "suite": "desktop",
  "generatedAt": "2026-09-15T01:46:46.094Z",
  "commit": "871984460043d2643fc5f6338d78b84b396f49c4",
  "environment": {
    "node": "v22.21.1",
    "platform": "linux",
    "runId": "34917780240"
  },
  "metrics": [
    { "name": "background.rendererIdleCpu", "unit": "ratio", "value": 0.26972690153651246 },
    { "name": "background.tabCpu", "unit": "ratio", "value": 0.26972690153651246 },
    { "name": "background.taskSlice", "unit": "ms", "value": 0.1000000000349246 },
    { "name": "core.forcedReflow", "unit": "count", "value": 0 },
    { "name": "core.frame.duration", "unit": "ms", "value": 16.69999999999709 },
    { "name": "core.frame.over16_7", "unit": "ratio", "value": 0 },
    { "name": "core.frame.over33", "unit": "ratio", "value": 0 },
    { "name": "core.gc.over50", "unit": "count", "value": 0 },
    { "name": "core.input.latency", "unit": "ms", "value": 24 },
    { "name": "core.interactive.longTask", "unit": "count", "value": 1 },
    { "name": "core.interactive.longTaskObserver", "unit": "count", "value": 1 },
    { "name": "core.main.block", "unit": "ms", "value": 0.20000000001164153 },
    { "name": "core.scroll.fps", "unit": "count", "value": 66.61115736885606 },
    { "name": "desktop.trace.main.browser_window_created.elapsedMs", "unit": "ms", "value": 623.846033 },
    { "name": "desktop.trace.main.create_window_start.elapsedMs", "unit": "ms", "value": 593.402045 },
    { "name": "desktop.trace.main.electron_ready.elapsedMs", "unit": "ms", "value": 588.351507 },
    { "name": "desktop.trace.main.load_url_start.elapsedMs", "unit": "ms", "value": 623.961961 },
    { "name": "desktop.trace.main.process_entry.elapsedMs", "unit": "ms", "value": 0.22831000000002177 },
    { "name": "desktop.trace.renderer.app_shell_mounted.elapsedMs", "unit": "ms", "value": 204 },
    { "name": "desktop.trace.renderer.document_editable.elapsedMs", "unit": "ms", "value": 79287.25 },
    { "name": "desktop.trace.renderer.document_first_screen.elapsedMs", "unit": "ms", "value": 79248.6 },
    { "name": "desktop.trace.renderer.document_open_start.elapsedMs", "unit": "ms", "value": 105813.20000000001 },
    { "name": "desktop.trace.renderer.editor_shell_mounted.elapsedMs", "unit": "ms", "value": 226.10000000000582 },
    { "name": "desktop.trace.renderer.first_editor_interactive.elapsedMs", "unit": "ms", "value": 79275.25 },
    { "name": "desktop.trace.renderer.initial_state_received.elapsedMs", "unit": "ms", "value": 194.1999999999971 },
    { "name": "desktop.trace.renderer.long_task.durationMs", "unit": "ms", "value": 600 },
    { "name": "desktop.trace.renderer.muya_init_end.durationMs", "unit": "ms", "value": 615.0999999999913 },
    { "name": "desktop.trace.renderer.muya_init_start.elapsedMs", "unit": "ms", "value": 396.6000000000058 },
    { "name": "desktop.trace.renderer.renderer_bootstrap_start.elapsedMs", "unit": "ms", "value": 193.8000000000029 },
    { "name": "desktop.trace.renderer.theme_applied.elapsedMs", "unit": "ms", "value": 194.8000000000029 },
    { "name": "memory.heapGrowth50", "unit": "ratio", "value": 0 },
    { "name": "memory.heapLinearGrowth", "unit": "count", "value": 0 },
    { "name": "memory.renderer.totalHeap", "unit": "bytes", "value": 47400000 },
    { "name": "memory.renderer.usedHeap", "unit": "bytes", "value": 35100000 },
    { "name": "parse.inputSync", "unit": "ms", "value": 17.30000000000291 },
    { "name": "soak.cycles", "unit": "count", "value": 70 },
    { "name": "soak.diagram", "unit": "ms", "value": 38.34999999998399 },
    { "name": "soak.durationMs", "unit": "ms", "value": 608278 },
    { "name": "soak.inputAction", "unit": "ms", "value": 38.54999999998836 },
    { "name": "soak.open50k", "unit": "ms", "value": 9694.200000000012 },
    { "name": "soak.outline", "unit": "ms", "value": 77.79999999998836 },
    { "name": "soak.save", "unit": "ms", "value": 129.75 },
    { "name": "soak.search", "unit": "ms", "value": 475.1000000000349 },
    { "name": "soak.tabSwitch", "unit": "ms", "value": 9660.899999999994 },
    { "name": "soak.tree", "unit": "ms", "value": 38.70000000001164 },
    { "name": "soak.undo", "unit": "ms", "value": 163.20000000001164 },
    { "name": "stability.cpuRunaway", "unit": "count", "value": 0 },
    { "name": "stability.crash", "unit": "count", "value": 0 },
    { "name": "stability.oom", "unit": "count", "value": 0 },
    { "name": "stability.rendererCrash", "unit": "count", "value": 0 },
    { "name": "stability.rendererHang", "unit": "count", "value": 0 }
  ]
}
